<?xml version="1.0" encoding="UTF-8"?>
<?xml-stylesheet type="text/css" href="1.css"?>
<body xmlns:xsi="http://www.w3.org/2001/XMLSchema-instance" xsi:noNamespaceSchemaLocation="3.xsd">
    <people>
        <name>Дарья</name>
        <surname>Домрачева</surname>
        <type>Биатлон</type>
        <awards>Олимпийское золото 2014</awards>
    </people>
    <people>
        <name>Алла</name>
        <surname>Цупер</surname>
        <type>Фристайл</type>
        <awards>Олимпийское золото 2014</awards>
    </people>
    <people>
        <name>Антон</name>
        <surname>Кушнир</surname>
        <type>Фристайл</type>
        <awards>Олимпийское золото 2014</awards>
    </people>
</body>